{
  "schema_version": 3,
  "host": "workstation",
  "os": "linux",
  "checkouts": {
    "HolobikeExperience": "/srv/ue/HolobikeExperience_uproject"
  },
  "toolchains": {
    "unreal_engine": {
      "5.3": "/srv/third_party/UnrealEngine-5.3.2-release",
      "5.7": "/srv/third_party/UnrealEngine-5.7.4-release"
    }
  }
}
